{
  "$schema": "../../source/schemas/audits/primitive-audits.schema.json",
  "type": "PRIMITIVE_AUDIT_MANIFEST",
  "schemaVersion": 1,
  "marketplace": "slopsentral",
  "entries": [
    {
      "type": "PRIMITIVE_AUDIT",
      "id": "routing-eval-family-productivity-evidence",
      "target": {
        "kind": "EVAL_FAMILY",
        "name": "routing-evals",
        "paths": [
          "source/evals/routing",
          "source/schemas/evals/routing-cases.schema.json",
          "source/schemas/evals/routing-replay.schema.json",
          "source/tools/run-routing-evals.mjs",
          "source/tools/validate-source-graph.mjs"
        ]
      },
      "baseline": "Earlier routing cases identified expected primitives and failure modes, but did not require each case to name the productive outcome or the evidence a good run must leave behind.",
      "decision": "PROMOTE_READY",
      "confidence": "HIGH",
      "reviewedAt": "2026-06-22",
      "reviewedBy": "codex",
      "capabilityBoundary": {
        "status": "PASS",
        "evidence": [
          "Routing evals are limited to primitive selection, forbidden fallbacks, recovery behavior, productive outcomes, and verification evidence.",
          "Daily-driver cases cover active-goal continuation, source-graph ownership, branch and PR delivery, CI triage, plugin install recovery, and production-sharing audit gates."
        ]
      },
      "schemaCoverage": {
        "status": "PASS",
        "evidence": [
          "source/schemas/evals/routing-cases.schema.json requires productiveOutcome and verificationEvidence for schemaVersion 2 cases.",
          "source/schemas/evals/routing-replay.schema.json defines provider-neutral replay observations for scored routing behavior.",
          "source/tools/validate-source-graph.mjs validates routing case schemaVersion, schema links, existing expected primitives, sanitized strings, and non-empty evidence fields.",
          "source/tools/run-routing-evals.mjs scores golden observations against exact case contracts, fixture-declared required cases, and explicit full-corpus coverage mode."
        ]
      },
      "provenance": {
        "status": "PASS",
        "firstPartyCollisionCheck": "NOT_APPLICABLE",
        "evidence": [
          "The cases are sanitized from local usage patterns and current repository contracts rather than copied from first-party provider material.",
          "Evidence references use source paths, memory-index summaries, and validation gates rather than raw transcripts, private absolute paths, or installed caches."
        ]
      },
      "validation": {
        "status": "PASS",
        "commands": [
          "node source/tools/validate-source-graph.mjs",
          "node source/tools/run-routing-evals.mjs",
          "node source/tools/run-routing-evals.mjs --require-all-observed",
          "intelligence project --source . --harness codex --out /tmp/slopsentral-codex",
          "intelligence project --source . --harness github-copilot --out /tmp/slopsentral-github-copilot",
          "git diff --check"
        ]
      },
      "runtimeSafety": {
        "status": "PASS",
        "evidence": [
          "The eval family is source evidence and does not require runtime-link activation before marketplace publication.",
          "The replay runner reads checked-in source and fixture data only; it does not install hooks, mutate provider caches, or write runtime targets."
        ]
      },
      "residualRisks": [
        "The checked-in golden replay now covers every routing case; future routing cases should add replay observations in the same change.",
        "Live model sessions should still be monitored for drift against these cases.",
        "Additional team-specific observations should be added as real users hit new routing misses or bypasses."
      ],
      "nextAction": "Use the default replay runner as the daily-driver production source gate and node source/tools/run-routing-evals.mjs --require-all-observed before claiming full-corpus routing readiness."
    },
    {
      "type": "PRIMITIVE_AUDIT",
      "id": "kotlin-engineering-plugin-production-readiness",
      "target": {
        "kind": "PLUGIN",
        "name": "kotlin-engineering",
        "paths": [
          "source/plugins/kotlin-engineering/plugin.json",
          "source/skills/kotlin-agentic-correctness",
          "source/skills/kotlin-gradle-validation",
          "source/skills/kotlin-review",
          "source/skills/kotlin-design-practices",
          "source/skills/negative-capability-proof",
          "source/agents/kotlin-review",
          "source/hooks/kotlin-horizontalization-check.hook.json",
          "source/hooks/gradle-check-green.hook.json",
          "source/profiles/kotlin-repo-default.json",
          "garden/manifests/runtime-links.json",
          "source/evals/routing/kotlin-engineering-workflows.json",
          "source/evals/plugin-benchmarks/kotlin-engineering.json",
          "source/schemas/evals/plugin-eval-benchmark.schema.json"
        ]
      },
      "baseline": "Kotlin Engineering had source primitives, a referential plugin manifest, and routing cases, but the plugin family did not yet have a durable production-readiness audit tying composition, provenance, validation, and residual rollout risks together.",
      "decision": "PROMOTE_READY",
      "confidence": "HIGH",
      "reviewedAt": "2026-06-22",
      "reviewedBy": "codex",
      "capabilityBoundary": {
        "status": "PASS",
        "evidence": [
          "source/plugins/kotlin-engineering/plugin.json scopes the plugin to typed Kotlin workflow, Kast-backed navigation, focused review, Gradle proof, and Kotlin-specific hooks.",
          "The plugin metadata explicitly excludes non-Kotlin repositories, generic Git/CI delivery, API-only contract governance, and platform marketplace authoring work.",
          "source/profiles/kotlin-repo-default.json composes kotlin-engineering with engineering-baseline and git-ci-operations instead of moving generic delivery ownership into the Kotlin plugin."
        ]
      },
      "schemaCoverage": {
        "status": "PASS",
        "evidence": [
          "source/tools/validate-source-graph.mjs validates plugin references, hook dependencies, profile duplicate ownership, audit target paths, and routing case expected primitives.",
          "source/tools/validate-source-graph.mjs validates garden/manifests/runtime-links.json source paths, approval boundaries, and Codex marketplace-import command shape.",
          "source/evals/routing/kotlin-engineering-workflows.json records Kotlin-specific route expectations for invariant work, Gradle failure diagnosis, negative capability proof, and companion delivery boundaries.",
          "source/evals/routing/fixtures/golden-routing-observations.json covers the Kotlin Engineering routing cases through the full-corpus replay gate.",
          "source/evals/plugin-benchmarks/kotlin-engineering.json defines real Codex benchmark scenarios for Kotlin Engineering and links each scenario back to an existing routing case and expected primitive.",
          "source/skills/kotlin-gradle-validation now owns the script-backed Gradle runner and JUnit, JaCoCo, and Kotlin build report parsers, removing the older duplicate Gradle-loop owner from active source.",
          "source/skills/negative-capability-proof now includes a proof-record helper that validates red and green proof phases before completion."
        ]
      },
      "provenance": {
        "status": "PASS",
        "firstPartyCollisionCheck": "CHECKED_NO_COLLISION",
        "evidence": [
          "garden/manifests/promotions.json records kotlin-engineering as a promoted referential composition and records the bundled Kotlin skills, review agents, hooks, concepts, and kotlin-repo-default profile.",
          "The plugin manifest references canonical source primitives by path instead of copying primitive payloads into source/plugins/kotlin-engineering.",
          "The canonical primitive names are local Kotlin workflow names and do not collide with first-party system skill names in this repository."
        ]
      },
      "validation": {
        "status": "PASS",
        "commands": [
          "node source/tools/validate-source-graph.mjs",
          "node source/skills/manage-json-schemas/scripts/schema-contracts.js policy --schema source/schemas/runtime/runtime-links.schema.json",
          "node source/skills/manage-json-schemas/scripts/schema-contracts.js policy --schema source/schemas/evals/routing-field-observations.schema.json",
          "node source/tools/run-routing-evals.mjs --require-all-observed",
          "intelligence project --source . --harness codex --out /tmp/slopsentral-codex",
          "intelligence project --source . --harness github-copilot --out /tmp/slopsentral-github-copilot",
          "git diff --check"
        ]
      },
      "runtimeSafety": {
        "status": "PASS",
        "evidence": [
          "Kotlin Engineering is exposed through source marketplace composition and does not require direct writes to runtime targets in this audit.",
          "garden/manifests/runtime-links.json records an approval-gated Codex marketplace import plan for kotlin-engineering@slopsentral.",
          "garden/manifests/runtime-links.json records read-only provider-visible evidence that kotlin-engineering@slopsentral is installed and enabled in the local Codex plugin list.",
          "The Kotlin hooks are represented as source hook manifests with explicit dependencies; runtime activation remains separate from harness projection.",
          "No cleanup or symlink replacement is recommended by this audit."
        ]
      },
      "residualRisks": [
        "Live Kotlin repository sessions should continue to add source/evals/routing/field-observations.json entries for trigger drift and loaded-but-bypassed behavior.",